CID,ExperimentID,SystemName,UserID,Command,BaseCommand,BaseCID,MissionID,args,before,after,Timestamp
563d4e41c1ea4ec6adf1758dce4151c1,0_VoiceMouse_123_04-05-2021,VoiceMouse,123,fix,fix,563d4e41c1ea4ec6adf1758dce4151c1,VoiceMouse_#0_0,fix,Once upn a time there ws only war She leapt up in triumph  blood driped from her sword as she swung it don on the bests neck hackng in a frenzy She laghd The taste of bood and seet revenge urged her on in her manc slayng of the creature that had No no that wasnt right Tearing the page awy and crumpling it into a ball he threw it over his shoulder to join its growing mass of brethren on the floor It was dark in the offie the curains shut to blck out the intrusion of the light He worked by a single lamp its artiicial brightness casting shadows about the roo Shadows were better than ghosts he supposed He licked his dry lps ignorig his thirst and the beginings of a headache When last had he drun anything No that wasnt important This wasOn the book shelf behnd him the rw of his best sellers stared down mockngly at him They were not storis like the one he was trying so desperately to write Thee were horror retellins of traditional fairy tales Storis where the wolf ate the girl the evil queen beame the fairet in the land and giants ruled the world below There were no god endings thereWhy cant you write a hapy storya childish voice whind in his earsHe turned almost expctingherto be standing behind him but there were only the shaows and his books Those books that had taken so many hours So much time A long time ago in a kindom far far away there lived a girl whoHe got up reaching for the first book on the shelf his firt novel The snarling face of an udead Cinderella stared up at him What had he mised writing this Her first birthay Her first word He couldnt remember just nowOpening it he peeed down at the dedication the only indication he had remembred her at all Who dediates a horror book to a baby He was such an idiot pageHe tore the page out and then the nextand te nextand the next One by oe they fell to the floor like snow until his movements became erratic gripping handfuls at a time and ripping them out He grabbed anoher book a canniblistic Gretel greeted him her brothers severed head grnning at the reader This one too joined the flurry of paper on the ground Stupid Stupid Stpid he chanted to hiself almost screaming the words outBook after book was torn apart helping him vnt his rage in that dark room He fially collpsed on the floor exhausted to his bones The blank pages of his notebook waitd for him He put his head back and cloed his eyes ,Once upn a time there ws only war She leapt up in triumph  blood driped from her sword as she swung it don on the bests neck hackng in a frenzy She light The taste of bood and seet revenge urged her on in her manc slayng of the creature that had No no that wasnt right Tearing the page awy and crumpling it into a ball he threw it over his shoulder to join its growing mass of brethren on the floor It was dark in the offie the curains shut to blck out the intrusion of the light He worked by a single lamp its artiicial brightness casting shadows about the roo Shadows were better than ghosts he supposed He licked his dry lps ignorig his thirst and the beginings of a headache When last had he drun anything No that wasnt important This wasOn the book shelf behnd him the rw of his best sellers stared down mockngly at him They were not storis like the one he was trying so desperately to write Thee were horror retellins of traditional fairy tales Storis where the wolf ate the girl the evil queen beame the fairet in the land and giants ruled the world below There were no god endings thereWhy cant you write a hapy storya childish voice whind in his earsHe turned almost expctingherto be standing behind him but there were only the shaows and his books Those books that had taken so many hours So much time A long time ago in a kindom far far away there lived a girl whoHe got up reaching for the first book on the shelf his firt novel The snarling face of an udead Cinderella stared up at him What had he mised writing this Her first birthay Her first word He couldnt remember just nowOpening it he peeed down at the dedication the only indication he had remembred her at all Who dediates a horror book to a baby He was such an idiot pageHe tore the page out and then the nextand te nextand the next One by oe they fell to the floor like snow until his movements became erratic gripping handfuls at a time and ripping them out He grabbed anoher book a canniblistic Gretel greeted him her brothers severed head grnning at the reader This one too joined the flurry of paper on the ground Stupid Stupid Stpid he chanted to hiself almost screaming the words outBook after book was torn apart helping him vnt his rage in that dark room He fially collpsed on the floor exhausted to his bones The blank pages of his notebook waitd for him He put his head back and cloed his eyes ,2021-05-04 12:39:11
232f22a59c4a4ade923b79a4b7ddb3ae,0_VoiceGaze_123_04-05-2021,VoiceGaze,123,fix,fix,232f22a59c4a4ade923b79a4b7ddb3ae,VoiceGaze_#0_1,fix,Day one the hottest day in July The kind of hot that mkes the neighbors forgo underear and plant themselves in front of oscillating fans Feet planted in small kiddie pools filled with tepid tap water topped off wth bagged ice from the crner market The breeze from the fan casting acros the iced pools dos nothing to dimiish the warmth from their radiating bodies Instead it pushes the sweat further acrss their faces and thighs util they are all shiny with sweatIts nearly impossible to forget day one You try yet day one is the day youll scrmble for breath Youll put on the braest of faces to give your daughter Thea oxygen as you hold the side of her head to your chest She will appreciate the firm pressure you apply to her quivering body The grief inunating from her youhful frame forcing you back- one two three steps until you both collapse onto the couch Sweat and tears theyre all the sameHw can a girl live without her mother How will I breathe without her modeling wht a strong exhale looks like You wonder in your motinal greed Where does she keep all of the passwords Theas birth certificate Is she allergic to anythingTheir day one is polar oppoite of your day one The body that carried you through life for the past four decads decided the narrative of livng a nice long life is a lie To find out that youre going to die is far less painful than hearng that you are dead The dead dont hear pain The dead dont feel it either You ae sent home with instructions of geting your affairs in order Pamphlets titled How to tell your loved ons that you are dying as if there is a siple bullet point plan to button up all of your affairs before you go Planning a funral is foreboding The weatherman says to epect more heat hazes You dont know exctly what that is but youve already spenthours on the internet searching for a cure Whats another few minutes Heat hze also called heat shimer another refers to the inferior mirage observed when viewing obects through a mass of heted air Relief flods your body panic eases up This isnt the ed its all a mirage It has to be Everthing after the first day is now called the in between and thats just how youve come to accept it Call your moter more but not so much tat she suspects tat there is something to be worried about Mothers know Revel in the fct that the word hug happns to be the first thre letters of your husbads name as he is the bet hugger youve ever met Hugging him a little bit longer feels like a possble cure for the inurable,Day one the hottest day in July The kind of hot that mkes the neighbors forgo underwear and plant themselves in front of oscillating fans Feet planted in small kiddie pools filled with tepid tap water topped off wth bagged ice from the crner market The breeze from the fan casting acros the iced pools dos nothing to dimiish the warmth from their radiating bodies Instead it pushes the sweat further acrss their faces and thighs util they are all shiny with sweatIts nearly impossible to forget day one You try yet day one is the day youll scrmble for breath Youll put on the braest of faces to give your daughter Thea oxygen as you hold the side of her head to your chest She will appreciate the firm pressure you apply to her quivering body The grief inunating from her youhful frame forcing you back- one two three steps until you both collapse onto the couch Sweat and tears theyre all the sameHw can a girl live without her mother How will I breathe without her modeling wht a strong exhale looks like You wonder in your motinal greed Where does she keep all of the passwords Theas birth certificate Is she allergic to anythingTheir day one is polar oppoite of your day one The body that carried you through life for the past four decads decided the narrative of livng a nice long life is a lie To find out that youre going to die is far less painful than hearng that you are dead The dead dont hear pain The dead dont feel it either You ae sent home with instructions of geting your affairs in order Pamphlets titled How to tell your loved ons that you are dying as if there is a siple bullet point plan to button up all of your affairs before you go Planning a funral is foreboding The weatherman says to epect more heat hazes You dont know exctly what that is but youve already spenthours on the internet searching for a cure Whats another few minutes Heat hze also called heat shimer another refers to the inferior mirage observed when viewing obects through a mass of heted air Relief flods your body panic eases up This isnt the ed its all a mirage It has to be Everthing after the first day is now called the in between and thats just how youve come to accept it Call your moter more but not so much tat she suspects tat there is something to be worried about Mothers know Revel in the fct that the word hug happns to be the first thre letters of your husbads name as he is the bet hugger youve ever met Hugging him a little bit longer feels like a possble cure for the inurable,2021-05-04 13:51:13
d9147e9e0edf4644a385a4c8ac5449f3,0_VoiceGaze_123_04-05-2021,VoiceGaze,123,replace,replace,d9147e9e0edf4644a385a4c8ac5449f3,VoiceGaze_#0_3,replace back to front,Day one the hottest day in July The kind of hot that mkes the neighbors forgo underwear and plant themselves in front of oscillating fans Feet planted in small kiddie pools filled with tepid tap water topped off wth bagged ice from the crner market The breeze from the fan casting acros the iced pools dos nothing to dimiish the warmth from their radiating bodies Instead it pushes the sweat further acrss their faces and thighs util they are all shiny with sweatIts nearly impossible to forget day one You try yet day one is the day youll scrmble for breath Youll put on the braest of faces to give your daughter Thea oxygen as you hold the side of her head to your chest She will appreciate the firm pressure you apply to her quivering body The grief inunating from her youhful frame forcing you back- one two three steps until you both collapse onto the couch Sweat and tears theyre all the sameHw can a girl live without her mother How will I breathe without her modeling wht a strong exhale looks like You wonder in your motinal greed Where does she keep all of the passwords Theas birth certificate Is she allergic to anythingTheir day one is polar oppoite of your day one The body that carried you through life for the past four decads decided the narrative of livng a nice long life is a lie To find out that youre going to die is far less painful than hearng that you are dead The dead dont hear pain The dead dont feel it either You ae sent home with instructions of geting your affairs in order Pamphlets titled How to tell your loved ons that you are dying as if there is a siple bullet point plan to button up all of your affairs before you go Planning a funral is foreboding The weatherman says to epect more heat hazes You dont know exctly what that is but youve already spenthours on the internet searching for a cure Whats another few minutes Heat hze also called heat shimer another refers to the inferior mirage observed when viewing obects through a mass of heted air Relief flods your body panic eases up This isnt the ed its all a mirage It has to be Everthing after the first day is now called the in between and thats just how youve come to accept it Call your moter more but not so much tat she suspects tat there is something to be worried about Mothers know Revel in the fct that the word hug happns to be the first thre letters of your husbads name as he is the bet hugger youve ever met Hugging him a little bit longer feels like a possble cure for the inurable,Day one the hottest day in July The kind of hot that mkes the neighbors forgo underwear and plant themselves in front of oscillating fans Feet planted in small kiddie pools filled with tepid tap water topped off wth bagged ice from the crner market The breeze from the fan casting acros the iced pools dos nothing to dimiish the warmth from their radiating bodies Instead it pushes the sweat further acrss their faces and thighs util they are all shiny with sweatIts nearly impossible to forget day one You try yet day one is the day youll scrmble for breath Youll put on the braest of faces to give your daughter Thea oxygen as you hold the side of her head to your chest She will appreciate the firm pressure you apply to her quivering body The grief inunating from her youhful frame forcing you front- one two three steps until you both collapse onto the couch Sweat and tears theyre all the sameHw can a girl live without her mother How will I breathe without her modeling wht a strong exhale looks like You wonder in your motinal greed Where does she keep all of the passwords Theas birth certificate Is she allergic to anythingTheir day one is polar oppoite of your day one The body that carried you through life for the past four decads decided the narrative of livng a nice long life is a lie To find out that youre going to die is far less painful than hearng that you are dead The dead dont hear pain The dead dont feel it either You ae sent home with instructions of geting your affairs in order Pamphlets titled How to tell your loved ons that you are dying as if there is a siple bullet point plan to button up all of your affairs before you go Planning a funral is foreboding The weatherman says to epect more heat hazes You dont know exctly what that is but youve already spenthours on the internet searching for a cure Whats another few minutes Heat hze also called heat shimer another refers to the inferior mirage observed when viewing obects through a mass of heted air Relief flods your body panic eases up This isnt the ed its all a mirage It has to be Everthing after the first day is now called the in between and thats just how youve come to accept it Call your moter more but not so much tat she suspects tat there is something to be worried about Mothers know Revel in the fct that the word hug happns to be the first thre letters of your husbads name as he is the bet hugger youve ever met Hugging him a little bit longer feels like a possble cure for the inurable,2021-05-04 13:51:35
e5d1cdc57581425d83354e66f23c3d61,0_VoiceGaze_123_04-05-2021,VoiceGaze,123,add,add,e5d1cdc57581425d83354e66f23c3d61,VoiceGaze_#0_5,add mother father,Day one the hottest day in July The kind of hot that mkes the neighbors forgo underwear and plant themselves in front of oscillating fans Feet planted in small kiddie pools filled with tepid tap water topped off wth bagged ice from the crner market The breeze from the fan casting acros the iced pools dos nothing to dimiish the warmth from their radiating bodies Instead it pushes the sweat further acrss their faces and thighs util they are all shiny with sweatIts nearly impossible to forget day one You try yet day one is the day youll scrmble for breath Youll put on the braest of faces to give your daughter Thea oxygen as you hold the side of her head to your chest She will appreciate the firm pressure you apply to her quivering body The grief inunating from her youhful frame forcing you front- one two three steps until you both collapse onto the couch Sweat and tears theyre all the sameHw can a girl live without her mother How will I breathe without her modeling wht a strong exhale looks like You wonder in your motinal greed Where does she keep all of the passwords Theas birth certificate Is she allergic to anythingTheir day one is polar oppoite of your day one The body that carried you through life for the past four decads decided the narrative of livng a nice long life is a lie To find out that youre going to die is far less painful than hearng that you are dead The dead dont hear pain The dead dont feel it either You ae sent home with instructions of geting your affairs in order Pamphlets titled How to tell your loved ons that you are dying as if there is a siple bullet point plan to button up all of your affairs before you go Planning a funral is foreboding The weatherman says to epect more heat hazes You dont know exctly what that is but youve already spenthours on the internet searching for a cure Whats another few minutes Heat hze also called heat shimer another refers to the inferior mirage observed when viewing obects through a mass of heted air Relief flods your body panic eases up This isnt the ed its all a mirage It has to be Everthing after the first day is now called the in between and thats just how youve come to accept it Call your moter more but not so much tat she suspects tat there is something to be worried about Mothers know Revel in the fct that the word hug happns to be the first thre letters of your husbads name as he is the bet hugger youve ever met Hugging him a little bit longer feels like a possble cure for the inurable,Day one the hottest day in July The kind of hot that mkes the neighbors forgo underwear and plant themselves in front of oscillating fans Feet planted in small kiddie pools filled with tepid tap water topped off wth bagged ice from the crner market The breeze from the fan casting acros the iced pools dos nothing to dimiish the warmth from their radiating bodies Instead it pushes the sweat further acrss their faces and thighs util they are all shiny with sweatIts nearly impossible to forget day one You try yet day one is the day youll scrmble for breath Youll put on the braest of faces to give your daughter Thea oxygen as you hold the side of her head to your chest She will appreciate the firm pressure you apply to her quivering body The grief inunating from her youhful frame forcing you front- one two three steps until you both collapse onto the couch Sweat and tears theyre all the sameHw can a girl live without her mother father How will I breathe without her modeling wht a strong exhale looks like You wonder in your motinal greed Where does she keep all of the passwords Theas birth certificate Is she allergic to anythingTheir day one is polar oppoite of your day one The body that carried you through life for the past four decads decided the narrative of livng a nice long life is a lie To find out that youre going to die is far less painful than hearng that you are dead The dead dont hear pain The dead dont feel it either You ae sent home with instructions of geting your affairs in order Pamphlets titled How to tell your loved ons that you are dying as if there is a siple bullet point plan to button up all of your affairs before you go Planning a funral is foreboding The weatherman says to epect more heat hazes You dont know exctly what that is but youve already spenthours on the internet searching for a cure Whats another few minutes Heat hze also called heat shimer another refers to the inferior mirage observed when viewing obects through a mass of heted air Relief flods your body panic eases up This isnt the ed its all a mirage It has to be Everthing after the first day is now called the in between and thats just how youve come to accept it Call your moter more but not so much tat she suspects tat there is something to be worried about Mothers know Revel in the fct that the word hug happns to be the first thre letters of your husbads name as he is the bet hugger youve ever met Hugging him a little bit longer feels like a possble cure for the inurable,2021-05-04 13:51:49
64d5613dcee24fb0ab68d90e3c5a026b,0_VoiceGaze_123_04-05-2021,VoiceGaze,123,fix,fix,64d5613dcee24fb0ab68d90e3c5a026b,VoiceGaze_#0_7,fix,Day one the hottest day in July The kind of hot that mkes the neighbors forgo underwear and plant themselves in front of oscillating fans Feet planted in small kiddie pools filled with tepid tap water topped off wth bagged ice from the crner market The breeze from the fan casting acros the iced pools dos nothing to dimiish the warmth from their radiating bodies Instead it pushes the sweat further acrss their faces and thighs util they are all shiny with sweatIts nearly impossible to forget day one You try yet day one is the day youll scrmble for breath Youll put on the braest of faces to give your daughter Thea oxygen as you hold the side of her head to your chest She will appreciate the firm pressure you apply to her quivering body The grief inunating from her youhful frame forcing you front- one two three steps until you both collapse onto the couch Sweat and tears theyre all the sameHw can a girl live without her mother father How will I breathe without her modeling wht a strong exhale looks like You wonder in your motinal greed Where does she keep all of the passwords Theas birth certificate Is she allergic to anythingTheir day one is polar oppoite of your day one The body that carried you through life for the past four decads decided the narrative of livng a nice long life is a lie To find out that youre going to die is far less painful than hearng that you are dead The dead dont hear pain The dead dont feel it either You ae sent home with instructions of geting your affairs in order Pamphlets titled How to tell your loved ons that you are dying as if there is a siple bullet point plan to button up all of your affairs before you go Planning a funral is foreboding The weatherman says to epect more heat hazes You dont know exctly what that is but youve already spenthours on the internet searching for a cure Whats another few minutes Heat hze also called heat shimer another refers to the inferior mirage observed when viewing obects through a mass of heted air Relief flods your body panic eases up This isnt the ed its all a mirage It has to be Everthing after the first day is now called the in between and thats just how youve come to accept it Call your moter more but not so much tat she suspects tat there is something to be worried about Mothers know Revel in the fct that the word hug happns to be the first thre letters of your husbads name as he is the bet hugger youve ever met Hugging him a little bit longer feels like a possble cure for the inurable,Day one the hottest day in July The kind of hot that mkes the neighbors forgo underwear and plant themselves in front of oscillating fans Feet planted in small kiddie pools filled with tepid tap water topped off wth bagged ice from the crner market The breeze from the fan casting acros the iced pools dos nothing to dimiish the warmth from their radiating bodies Instead it pushes the sweat further acrss their faces and thighs util they are all shiny with sweatIts nearly impossible to forget day one You try yet day one is the day youll scrmble for breath Youll put on the braest of faces to give your daughter Thea oxygen as you hold the side of her head to your chest She will appreciate the firm pressure you apply to her quivering body The grief inunating from her youhful frame forcing you front- one two three steps until you both collapse onto the couch Sweat and tears theyre all the sameHw can a girl live without her mother father How will I breathe without her modeling wht a strong exhale looks like You wonder in your motinal greed Where does she keep all of the passwords Theas birth certificate Is she allergic to anythingTheir day one is polar oppoite of your day one The body that carried you through life for the past four decads decided the narrative of livng a nice long life is a lie To find out that youre going to die is far less painful than hearng that you are dead The dead dont hear pain The dead dont feel it either You ae sent home with instructions of geting your affairs in order Pamphlets titled How to tell your loved ons that you are dying as if there is a simple bullet point plan to button up all of your affairs before you go Planning a funral is foreboding The weatherman says to epect more heat hazes You dont know exctly what that is but youve already spenthours on the internet searching for a cure Whats another few minutes Heat hze also called heat shimer another refers to the inferior mirage observed when viewing obects through a mass of heted air Relief flods your body panic eases up This isnt the ed its all a mirage It has to be Everthing after the first day is now called the in between and thats just how youve come to accept it Call your moter more but not so much tat she suspects tat there is something to be worried about Mothers know Revel in the fct that the word hug happns to be the first thre letters of your husbads name as he is the bet hugger youve ever met Hugging him a little bit longer feels like a possble cure for the inurable,2021-05-04 13:52:07
