CID,ExperimentID,SystemName,UserID,Command,BaseCommand,BaseCID,MissionID,args,before,after,Timestamp
cd5ee7971baf4e6a994228f3b968c6dd,0_VoiceMouse_123456789_23-05-2021,VoiceMouse,123456789,replace,replace,cd5ee7971baf4e6a994228f3b968c6dd,VoiceMouse_#0_9,replace garden to balcony,In Our TimeEverybody was drnk The whole battery was drunk going along the road in the dark We wee going to the Champagne The lieuteant kept ridng his horse out ino the fields and saying to him Im drunk I tell you mon vieux Oh I am so soued We went along the road all night in the drk and the adjutant kept ridng up alongside my kitchen and saying You must put it out It is dangerous It will be observd We were fifti kilometers from the front but the adjutant worried about the fire in my kitchen It was funny going along that road That was when I first was a kitchen corpralThe first great matador got the horn thrugh his sword hnd and the crow hooted him out The second matador sliped and the bull caught him through the belly and he hng on to the horn with one hand and held the other tight against the place and the bull rammed him wham agaist the wall and the horn came out and he lay in the sand and then got up like crazy drunk and tried to slueg the men carrying him away and yed for his sword but he fainted The kid came out and had to kill five bulls because you cant have more than three matadors and the last bull he was so tired he couldnt get the sword in He couldnt hardly lift his arm He tried five times and the crowd was quiet because it was a good bull and it looked like him or the bull and then he finally made it He sat down in the sand and puked and they held a cape over him while the crowd hollered and threw things down into the bull ring down in the sand Minarets stuck up in the rain out of Adrianople across the mud flats The carts were jammed for thirty miles along the Karagatch road Water buffalo and cattle were hauling carts through the mud No end and no beginning Just carts loaded with everything they owned The old men and women soaked through walked along keeping the cattle moving The Maritza was running yellow almost up to the bridge Carts were jammed solid on the bridge with camels bobbing along through them Greek cavalry herded along the procession Women and kids were in the carts crouched with mattresses mirrors sewing machines bundles There was a woman having a kid with a young girl holding a blanket over her and crying Scared sick looking at it It rained all through the evacuationWe were in a garden at Mons Young Buckley came in with his patrol from across the river The first German I saw climbed up over the garden wall We waited till he got one leg over and then potted him He had so much equipment on and looked awfully surprised and fell down into the garden Then three more came over further down the wall We shot them They all came just like that,In Our TimeEverybody was drnk The whole battery was drunk going along the road in the dark We wee going to the Champagne The lieuteant kept ridng his horse out ino the fields and saying to him Im drunk I tell you mon vieux Oh I am so soued We went along the road all night in the drk and the adjutant kept ridng up alongside my kitchen and saying You must put it out It is dangerous It will be observd We were fifti kilometers from the front but the adjutant worried about the fire in my kitchen It was funny going along that road That was when I first was a kitchen corpralThe first great matador got the horn thrugh his sword hnd and the crow hooted him out The second matador sliped and the bull caught him through the belly and he hng on to the horn with one hand and held the other tight against the place and the bull rammed him wham agaist the wall and the horn came out and he lay in the sand and then got up like crazy drunk and tried to slueg the men carrying him away and yed for his sword but he fainted The kid came out and had to kill five bulls because you cant have more than three matadors and the last bull he was so tired he couldnt get the sword in He couldnt hardly lift his arm He tried five times and the crowd was quiet because it was a good bull and it looked like him or the bull and then he finally made it He sat down in the sand and puked and they held a cape over him while the crowd hollered and threw things down into the bull ring down in the sand Minarets stuck up in the rain out of Adrianople across the mud flats The carts were jammed for thirty miles along the Karagatch road Water buffalo and cattle were hauling carts through the mud No end and no beginning Just carts loaded with everything they owned The old men and women soaked through walked along keeping the cattle moving The Maritza was running yellow almost up to the bridge Carts were jammed solid on the bridge with camels bobbing along through them Greek cavalry herded along the procession Women and kids were in the carts crouched with mattresses mirrors sewing machines bundles There was a woman having a kid with a young girl holding a blanket over her and crying Scared sick looking at it It rained all through the evacuationWe were in a balcony at Mons Young Buckley came in with his patrol from across the river The first German I saw climbed up over the garden wall We waited till he got one leg over and then potted him He had so much equipment on and looked awfully surprised and fell down into the garden Then three more came over further down the wall We shot them They all came just like that,2021-05-23 18:44:58
e80d8be07a334861858657a1c6e66269,0_VoiceMouse_123456789_23-05-2021,VoiceMouse,123456789,fix,fix,e80d8be07a334861858657a1c6e66269,VoiceMouse_#0_11,fix,In Our TimeEverybody was drnk The whole battery was drunk going along the road in the dark We wee going to the Champagne The lieuteant kept ridng his horse out ino the fields and saying to him Im drunk I tell you mon vieux Oh I am so soued We went along the road all night in the drk and the adjutant kept ridng up alongside my kitchen and saying You must put it out It is dangerous It will be observd We were fifti kilometers from the front but the adjutant worried about the fire in my kitchen It was funny going along that road That was when I first was a kitchen corpralThe first great matador got the horn thrugh his sword hnd and the crow hooted him out The second matador sliped and the bull caught him through the belly and he hng on to the horn with one hand and held the other tight against the place and the bull rammed him wham agaist the wall and the horn came out and he lay in the sand and then got up like crazy drunk and tried to slueg the men carrying him away and yed for his sword but he fainted The kid came out and had to kill five bulls because you cant have more than three matadors and the last bull he was so tired he couldnt get the sword in He couldnt hardly lift his arm He tried five times and the crowd was quiet because it was a good bull and it looked like him or the bull and then he finally made it He sat down in the sand and puked and they held a cape over him while the crowd hollered and threw things down into the bull ring down in the sand Minarets stuck up in the rain out of Adrianople across the mud flats The carts were jammed for thirty miles along the Karagatch road Water buffalo and cattle were hauling carts through the mud No end and no beginning Just carts loaded with everything they owned The old men and women soaked through walked along keeping the cattle moving The Maritza was running yellow almost up to the bridge Carts were jammed solid on the bridge with camels bobbing along through them Greek cavalry herded along the procession Women and kids were in the carts crouched with mattresses mirrors sewing machines bundles There was a woman having a kid with a young girl holding a blanket over her and crying Scared sick looking at it It rained all through the evacuationWe were in a balcony at Mons Young Buckley came in with his patrol from across the river The first German I saw climbed up over the garden wall We waited till he got one leg over and then potted him He had so much equipment on and looked awfully surprised and fell down into the garden Then three more came over further down the wall We shot them They all came just like that,In Our TimeEverybody was drnk The whole battery was drunk going along the road in the dark We wee going to the Champagne The lieuteant kept ridng his horse out ino the fields and saying to him Im drunk I tell you mon vieux Oh I am so soued We went along the road all night in the drk and the adjutant kept ridng up alongside my kitchen and saying You must put it out It is dangerous It will be observd We were fifti kilometers from the front but the adjutant worried about the fire in my kitchen It was funny going along that road That was when I first was a kitchen corpralThe first great matador got the horn thrugh his sword hnd and the crow hooted him out The second matador sliped and the bull caught him through the belly and he hng on to the horn with one hand and held the other tight against the place and the bull rammed him wham agaist the wall and the horn came out and he lay in the sand and then got up like crazy drunk and tried to slug the men carrying him away and yed for his sword but he fainted The kid came out and had to kill five bulls because you cant have more than three matadors and the last bull he was so tired he couldnt get the sword in He couldnt hardly lift his arm He tried five times and the crowd was quiet because it was a good bull and it looked like him or the bull and then he finally made it He sat down in the sand and puked and they held a cape over him while the crowd hollered and threw things down into the bull ring down in the sand Minarets stuck up in the rain out of Adrianople across the mud flats The carts were jammed for thirty miles along the Karagatch road Water buffalo and cattle were hauling carts through the mud No end and no beginning Just carts loaded with everything they owned The old men and women soaked through walked along keeping the cattle moving The Maritza was running yellow almost up to the bridge Carts were jammed solid on the bridge with camels bobbing along through them Greek cavalry herded along the procession Women and kids were in the carts crouched with mattresses mirrors sewing machines bundles There was a woman having a kid with a young girl holding a blanket over her and crying Scared sick looking at it It rained all through the evacuationWe were in a balcony at Mons Young Buckley came in with his patrol from across the river The first German I saw climbed up over the garden wall We waited till he got one leg over and then potted him He had so much equipment on and looked awfully surprised and fell down into the garden Then three more came over further down the wall We shot them They all came just like that,2021-05-23 18:45:08
7e5417faa80c469db6081a9fd0db6b66,0_VoiceMouse_123456789_23-05-2021,VoiceMouse,123456789,options,fix,e80d8be07a334861858657a1c6e66269,VoiceMouse_#0_11,options 1,In Our TimeEverybody was drnk The whole battery was drunk going along the road in the dark We wee going to the Champagne The lieuteant kept ridng his horse out ino the fields and saying to him Im drunk I tell you mon vieux Oh I am so soued We went along the road all night in the drk and the adjutant kept ridng up alongside my kitchen and saying You must put it out It is dangerous It will be observd We were fifti kilometers from the front but the adjutant worried about the fire in my kitchen It was funny going along that road That was when I first was a kitchen corpralThe first great matador got the horn thrugh his sword hnd and the crow hooted him out The second matador sliped and the bull caught him through the belly and he hng on to the horn with one hand and held the other tight against the place and the bull rammed him wham agaist the wall and the horn came out and he lay in the sand and then got up like crazy drunk and tried to slug the men carrying him away and yed for his sword but he fainted The kid came out and had to kill five bulls because you cant have more than three matadors and the last bull he was so tired he couldnt get the sword in He couldnt hardly lift his arm He tried five times and the crowd was quiet because it was a good bull and it looked like him or the bull and then he finally made it He sat down in the sand and puked and they held a cape over him while the crowd hollered and threw things down into the bull ring down in the sand Minarets stuck up in the rain out of Adrianople across the mud flats The carts were jammed for thirty miles along the Karagatch road Water buffalo and cattle were hauling carts through the mud No end and no beginning Just carts loaded with everything they owned The old men and women soaked through walked along keeping the cattle moving The Maritza was running yellow almost up to the bridge Carts were jammed solid on the bridge with camels bobbing along through them Greek cavalry herded along the procession Women and kids were in the carts crouched with mattresses mirrors sewing machines bundles There was a woman having a kid with a young girl holding a blanket over her and crying Scared sick looking at it It rained all through the evacuationWe were in a balcony at Mons Young Buckley came in with his patrol from across the river The first German I saw climbed up over the garden wall We waited till he got one leg over and then potted him He had so much equipment on and looked awfully surprised and fell down into the garden Then three more came over further down the wall We shot them They all came just like that,In Our TimeEverybody was drnk The whole battery was drunk going along the road in the dark We wee going to the Champagne The lieuteant kept ridng his horse out ino the fields and saying to him Im drunk I tell you mon vieux Oh I am so soued We went along the road all night in the drk and the adjutant kept ridng up alongside my kitchen and saying You must put it out It is dangerous It will be observd We were fifti kilometers from the front but the adjutant worried about the fire in my kitchen It was funny going along that road That was when I first was a kitchen corpralThe first great matador got the horn thrugh his sword hnd and the crow hooted him out The second matador sliped and the bull caught him through the belly and he hng on to the horn with one hand and held the other tight against the place and the bull rammed him wham agaist the wall and the horn came out and he lay in the sand and then got up like crazy drunk and tried to slue the men carrying him away and yed for his sword but he fainted The kid came out and had to kill five bulls because you cant have more than three matadors and the last bull he was so tired he couldnt get the sword in He couldnt hardly lift his arm He tried five times and the crowd was quiet because it was a good bull and it looked like him or the bull and then he finally made it He sat down in the sand and puked and they held a cape over him while the crowd hollered and threw things down into the bull ring down in the sand Minarets stuck up in the rain out of Adrianople across the mud flats The carts were jammed for thirty miles along the Karagatch road Water buffalo and cattle were hauling carts through the mud No end and no beginning Just carts loaded with everything they owned The old men and women soaked through walked along keeping the cattle moving The Maritza was running yellow almost up to the bridge Carts were jammed solid on the bridge with camels bobbing along through them Greek cavalry herded along the procession Women and kids were in the carts crouched with mattresses mirrors sewing machines bundles There was a woman having a kid with a young girl holding a blanket over her and crying Scared sick looking at it It rained all through the evacuationWe were in a balcony at Mons Young Buckley came in with his patrol from across the river The first German I saw climbed up over the garden wall We waited till he got one leg over and then potted him He had so much equipment on and looked awfully surprised and fell down into the garden Then three more came over further down the wall We shot them They all came just like that,2021-05-23 18:45:33
0c593cea35fb405b84249a7e085b4b91,0_VoiceMouse_123456789_23-05-2021,VoiceMouse,123456789,delete from to,delete from to,0c593cea35fb405b84249a7e085b4b91,VoiceMouse_#0_13,delete from Water to mad,In Our TimeEverybody was drnk The whole battery was drunk going along the road in the dark We wee going to the Champagne The lieuteant kept ridng his horse out ino the fields and saying to him Im drunk I tell you mon vieux Oh I am so soued We went along the road all night in the drk and the adjutant kept ridng up alongside my kitchen and saying You must put it out It is dangerous It will be observd We were fifti kilometers from the front but the adjutant worried about the fire in my kitchen It was funny going along that road That was when I first was a kitchen corpralThe first great matador got the horn thrugh his sword hnd and the crow hooted him out The second matador sliped and the bull caught him through the belly and he hng on to the horn with one hand and held the other tight against the place and the bull rammed him wham agaist the wall and the horn came out and he lay in the sand and then got up like crazy drunk and tried to slue the men carrying him away and yed for his sword but he fainted The kid came out and had to kill five bulls because you cant have more than three matadors and the last bull he was so tired he couldnt get the sword in He couldnt hardly lift his arm He tried five times and the crowd was quiet because it was a good bull and it looked like him or the bull and then he finally made it He sat down in the sand and puked and they held a cape over him while the crowd hollered and threw things down into the bull ring down in the sand Minarets stuck up in the rain out of Adrianople across the mud flats The carts were jammed for thirty miles along the Karagatch road Water buffalo and cattle were hauling carts through the mud No end and no beginning Just carts loaded with everything they owned The old men and women soaked through walked along keeping the cattle moving The Maritza was running yellow almost up to the bridge Carts were jammed solid on the bridge with camels bobbing along through them Greek cavalry herded along the procession Women and kids were in the carts crouched with mattresses mirrors sewing machines bundles There was a woman having a kid with a young girl holding a blanket over her and crying Scared sick looking at it It rained all through the evacuationWe were in a balcony at Mons Young Buckley came in with his patrol from across the river The first German I saw climbed up over the garden wall We waited till he got one leg over and then potted him He had so much equipment on and looked awfully surprised and fell down into the garden Then three more came over further down the wall We shot them They all came just like that,In Our TimeEverybody was drnk The whole battery was drunk going along the road in the dark We wee going to the Champagne The lieuteant kept ridng his horse out ino the fields and saying to him Im drunk I tell you mon vieux Oh I am so soued We went along the road all night in the drk and the adjutant kept ridng up alongside my kitchen and saying You must put it out It is dangerous It will be observd We were fifti kilometers from the front but the adjutant worried about the fire in my kitchen It was funny going along that road That was when I first was a kitchen corpralThe first great matador got the horn thrugh his sword hnd and the crow hooted him out The second matador sliped and the bull caught him through the belly and he hng on to the horn with one hand and held the other tight against the place and the bull rammed him wham agaist the wall and the horn came out and he lay in the sand and then got up like crazy drunk and tried to slue the men carrying him away and yed for his sword but he fainted The kid came out and had to kill five bulls because you cant have more than three matadors and the last bull he was so tired he couldnt get the sword in He couldnt hardly lift his arm He tried five times and the crowd was quiet because it was a good bull and it looked like him or the bull and then he finally made it He sat down in the sand and puked and they held a cape over him while the crowd hollered and threw things down into the bull ring down in the sand Minarets stuck up in the rain out of Adrianople across the mud flats The carts were jammed for thirty miles along the Karagatch road  No end and no beginning Just carts loaded with everything they owned The old men and women soaked through walked along keeping the cattle moving The Maritza was running yellow almost up to the bridge Carts were jammed solid on the bridge with camels bobbing along through them Greek cavalry herded along the procession Women and kids were in the carts crouched with mattresses mirrors sewing machines bundles There was a woman having a kid with a young girl holding a blanket over her and crying Scared sick looking at it It rained all through the evacuationWe were in a balcony at Mons Young Buckley came in with his patrol from across the river The first German I saw climbed up over the garden wall We waited till he got one leg over and then potted him He had so much equipment on and looked awfully surprised and fell down into the garden Then three more came over further down the wall We shot them They all came just like that,2021-05-23 18:47:10
7593ab1a159f40f6a0dc9ec3f9a33849,1_VoiceMouse_123456789_23-05-2021,VoiceMouse,123456789,fix,fix,7593ab1a159f40f6a0dc9ec3f9a33849,VoiceMouse_#1_1,fix,One Summer NightThe fact that Henry Armstrong was buried did not sem to him to prove tat he was dead he had alwys been a hard man to convince That he relly was buried the testimony of his senses compelled him to admit  His posture flat upon his back with his hands crossed upon his stomach and tied with something that he easly broke without profitably alteing the situation the strict confinement of his entire person the black darkness and profound silnce made a body of evidence impossible to controvert and he accepted it without cavil But dead no he was only very very ill He had wital the invalids apathy and did not greatly concern himself about the uncomon fate that had een allotted to him No philosopher was he just a plain commonplace person gifted for the being with a pathological indifference the organ that he feared consequences with was torpid So with no particular apprehension for his immdiate future he fell aslep and all was peace with Hnry Armstrong  But soething was going on overhad It was a dark sumer night shot through with infrequent shimmers of lightning silently firing a cloud lying low in the est and portending a storm These brief stammering illuminations brought out with ghasly Distinctness the monments and headstones of the cemetey and seemed to set them dancing It was not a night in which any credible witnss was likely to be straying about a cemetery so the three men who wee there digging into the grave of Hery Armstrong felt reasonably secure Two of them were yong students from a medical college a few miles aay the third was a gigantic negro known as Jess For many years Jess had been employed about the cemtery as a man-of-all-work and his favorite pleasntry that he knew every sol in the place  From the natre of what he was now doing it was inferble that the place was not so popuous as its register may have shown it to be Outside the wall at the part of the grounds farthest from the public road were a hore and a light wagon waitng ,One Summer NightThe fact that Henry Armstrong was buried did not sem to him to prove tat he was dead he had always been a hard man to convince That he relly was buried the testimony of his senses compelled him to admit  His posture flat upon his back with his hands crossed upon his stomach and tied with something that he easly broke without profitably alteing the situation the strict confinement of his entire person the black darkness and profound silnce made a body of evidence impossible to controvert and he accepted it without cavil But dead no he was only very very ill He had wital the invalids apathy and did not greatly concern himself about the uncomon fate that had een allotted to him No philosopher was he just a plain commonplace person gifted for the being with a pathological indifference the organ that he feared consequences with was torpid So with no particular apprehension for his immdiate future he fell aslep and all was peace with Hnry Armstrong  But soething was going on overhad It was a dark sumer night shot through with infrequent shimmers of lightning silently firing a cloud lying low in the est and portending a storm These brief stammering illuminations brought out with ghasly Distinctness the monments and headstones of the cemetey and seemed to set them dancing It was not a night in which any credible witnss was likely to be straying about a cemetery so the three men who wee there digging into the grave of Hery Armstrong felt reasonably secure Two of them were yong students from a medical college a few miles aay the third was a gigantic negro known as Jess For many years Jess had been employed about the cemtery as a man-of-all-work and his favorite pleasntry that he knew every sol in the place  From the natre of what he was now doing it was inferble that the place was not so popuous as its register may have shown it to be Outside the wall at the part of the grounds farthest from the public road were a hore and a light wagon waitng ,2021-05-23 18:47:43
