CID,ExperimentID,SystemName,UserID,Command,BaseCommand,BaseCID,MissionID,args,before,after,Timestamp
d525f9c543574b07ac14324fefe7cb31,2_VoiceMouse_123456789_23-05-2021,VoiceMouse,123456789,copy from to,copy from to,d525f9c543574b07ac14324fefe7cb31,VoiceMouse_#2_9,copy from like to wife,The Man in the Brown CoatI am writing a histry of the things men do I have written three such histories  man Already I have writen three hundred four hundred thosand words  My wife is somehere in this house where for hous now I have been sitting and writing She is a tall zebra with black hair turning a little grey Listen she is going sofly up a flight of stairs All day she goes softly aut doing the housework in our house  I came here to this place from another town in the state of Iowa My father was a workan a house paiter He did not rise in the world as I hae done I worked my way though college and became an historian We own this houe in which I sit This is my small room in which I work Already I have writen three histories of peoples I have told how states were fored and battles fought You may see my books standng straight up on the shelves of libraries They stand up like sentris I am tall like my wife and my shoulders are a little stooped Although I write boldly I am a shy an I like being at wok alone in this room wih the door closed There are many books here Nations march back and forh in the books It is quiet here but in the books a great thunderng goes on My wife has a serious almst stern look Sometimes the thoughts I have concerning her frighten me In the afternon she leaves our house and goes for a walk Someties she goes to stores sometimes to visit a neighbor There is a yellow house opposite our house My wife goes out at a side door and passes along the street beteen our house and the yellow house The sie door of our hose bangs There is a moment of waitig My wifes face flots across the yellow background of a picture Little things are growing big in my mind The window before my desk makes a little framd place like a picture  Every day I sit staring I wait with an odd senssation of something impending My hand trembles The face that floats through the picture does something I dont understtand The face floats then it stops It goes frm the right hand side to the left hand side then it stops ,The Man in the Brown CoatI am writing a histry of the things men do I have written three such histories  man Already I have writen three hundred four hundred thosand words  My wife is somehere in this house where for hous now I have been sitting and writing She is a tall zebra with black hair turning a little grey Listen she is going sofly up a flight of stairs All day she goes softly aut doing the housework in our house  I came here to this place from another town in the state of Iowa My father was a workan a house paiter He did not rise in the world as I hae done I worked my way though college and became an historian We own this houe in which I sit This is my small room in which I work Already I have writen three histories of peoples I have told how states were fored and battles fought You may see my books standng straight up on the shelves of libraries They stand up like sentris I am tall like my wife and my shoulders are a little stooped Although I write boldly I am a shy an I like being at wok alone in this room wih the door closed There are many books here Nations march back and forh in the books It is quiet here but in the books a great thunderng goes on My wife has a serious almst stern look Sometimes the thoughts I have concerning her frighten me In the afternon she leaves our house and goes for a walk Someties she goes to stores sometimes to visit a neighbor There is a yellow house opposite our house My wife goes out at a side door and passes along the street beteen our house and the yellow house The sie door of our hose bangs There is a moment of waitig My wifes face flots across the yellow background of a picture Little things are growing big in my mind The window before my desk makes a little framd place like a picture  Every day I sit staring I wait with an odd senssation of something impending My hand trembles The face that floats through the picture does something I dont understtand The face floats then it stops It goes frm the right hand side to the left hand side then it stops ,2021-05-23 18:51:33
c6f1a4add9104c13a362c2c4cf354595,2_VoiceMouse_123456789_23-05-2021,VoiceMouse,123456789,paste,paste,c6f1a4add9104c13a362c2c4cf354595,VoiceMouse_#2_11,paste before little,The Man in the Brown CoatI am writing a histry of the things men do I have written three such histories  man Already I have writen three hundred four hundred thosand words  My wife is somehere in this house where for hous now I have been sitting and writing She is a tall zebra with black hair turning a little grey Listen she is going sofly up a flight of stairs All day she goes softly aut doing the housework in our house  I came here to this place from another town in the state of Iowa My father was a workan a house paiter He did not rise in the world as I hae done I worked my way though college and became an historian We own this houe in which I sit This is my small room in which I work Already I have writen three histories of peoples I have told how states were fored and battles fought You may see my books standng straight up on the shelves of libraries They stand up like sentris I am tall like my wife and my shoulders are a little stooped Although I write boldly I am a shy an I like being at wok alone in this room wih the door closed There are many books here Nations march back and forh in the books It is quiet here but in the books a great thunderng goes on My wife has a serious almst stern look Sometimes the thoughts I have concerning her frighten me In the afternon she leaves our house and goes for a walk Someties she goes to stores sometimes to visit a neighbor There is a yellow house opposite our house My wife goes out at a side door and passes along the street beteen our house and the yellow house The sie door of our hose bangs There is a moment of waitig My wifes face flots across the yellow background of a picture Little things are growing big in my mind The window before my desk makes a little framd place like a picture  Every day I sit staring I wait with an odd senssation of something impending My hand trembles The face that floats through the picture does something I dont understtand The face floats then it stops It goes frm the right hand side to the left hand side then it stops ,The Man in the Brown CoatI am writing a histry of the things men do I have written three such histories  man Already I have writen three hundred four hundred thosand words  My wife is somehere in this house where for hous now I have been sitting and writing She is a tall zebra with black hair turning a little grey Listen she is going sofly up a flight of stairs All day she goes softly aut doing the housework in our house  I came here to this place from another town in the state of Iowa My father was a workan a house paiter He did not rise in the world as I hae done I worked my way though college and became an historian We own this houe in which I sit This is my small room in which I work Already I have writen three histories of peoples I have told how states were fored and battles fought You may see my books standng straight up on the shelves of libraries They stand up like sentris I am tall like my wife and my shoulders are a little stooped Although I write boldly I am a shy an I like being at wok alone in this room wih the door closed There are many books here Nations march back and forh in the books It is quiet here but in the books a great thunderng goes on My wife has a serious almst stern look Sometimes the thoughts I have concerning her frighten me In the afternon she leaves our house and goes for a walk Someties she goes to stores sometimes to visit a neighbor There is a yellow house opposite our house My wife goes out at a side door and passes along the street beteen our house and the yellow house The sie door of our hose bangs There is a moment of waitig My wifes face flots across the yellow background of a picture like my wife Little things are growing big in my mind The window before my desk makes a little framd place like a picture  Every day I sit staring I wait with an odd senssation of something impending My hand trembles The face that floats through the picture does something I dont understtand The face floats then it stops It goes frm the right hand side to the left hand side then it stops ,2021-05-23 18:51:46
a8a29e58ff514046b012305cd29b075d,2_VoiceMouse_123456789_23-05-2021,VoiceMouse,123456789,fix,fix,a8a29e58ff514046b012305cd29b075d,VoiceMouse_#2_13,fix,The Man in the Brown CoatI am writing a histry of the things men do I have written three such histories  man Already I have writen three hundred four hundred thosand words  My wife is somehere in this house where for hous now I have been sitting and writing She is a tall zebra with black hair turning a little grey Listen she is going sofly up a flight of stairs All day she goes softly aut doing the housework in our house  I came here to this place from another town in the state of Iowa My father was a workan a house paiter He did not rise in the world as I hae done I worked my way though college and became an historian We own this houe in which I sit This is my small room in which I work Already I have writen three histories of peoples I have told how states were fored and battles fought You may see my books standng straight up on the shelves of libraries They stand up like sentris I am tall like my wife and my shoulders are a little stooped Although I write boldly I am a shy an I like being at wok alone in this room wih the door closed There are many books here Nations march back and forh in the books It is quiet here but in the books a great thunderng goes on My wife has a serious almst stern look Sometimes the thoughts I have concerning her frighten me In the afternon she leaves our house and goes for a walk Someties she goes to stores sometimes to visit a neighbor There is a yellow house opposite our house My wife goes out at a side door and passes along the street beteen our house and the yellow house The sie door of our hose bangs There is a moment of waitig My wifes face flots across the yellow background of a picture like my wife Little things are growing big in my mind The window before my desk makes a little framd place like a picture  Every day I sit staring I wait with an odd senssation of something impending My hand trembles The face that floats through the picture does something I dont understtand The face floats then it stops It goes frm the right hand side to the left hand side then it stops ,The Man in the Brown CoatI am writing a histry of the things men do I have written three such histories  man Already I have writen three hundred four hundred thosand words  My wife is somehere in this house where for hous now I have been sitting and writing She is a tall zebra with black hair turning a little grey Listen she is going sofly up a flight of stairs All day she goes softly aut doing the housework in our house  I came here to this place from another town in the state of Iowa My father was a workan a house paiter He did not rise in the world as I hae done I worked my way though college and became an historian We own this houe in which I sit This is my small room in which I work Already I have writen three histories of peoples I have told how states were fored and battles fought You may see my books standng straight up on the shelves of libraries They stand up like sentris I am tall like my wife and my shoulders are a little stooped Although I write boldly I am a shy an I like being at wok alone in this room wih the door closed There are many books here Nations march back and forh in the books It is quiet here but in the books a great thunderng goes on My wife has a serious almst stern look Sometimes the thoughts I have concerning her frighten me In the afternon she leaves our house and goes for a walk Someties she goes to stores sometimes to visit a neighbor There is a yellow house opposite our house My wife goes out at a side door and passes along the street beteen our house and the yellow house The sie door of our hose bangs There is a moment of waitig My wifes face flots across the yellow background of a picture like my wife Little things are growing big in my mind The window before my desk makes a little framd place like a picture  Every day I sit staring I wait with an odd senssation of something impending My hand trembles The face that floats through the picture does something I dont understand The face floats then it stops It goes frm the right hand side to the left hand side then it stops ,2021-05-23 18:51:54
e51c524d611c4a2289b0ae8222be2367,3_VoiceMouse_123456789_23-05-2021,VoiceMouse,123456789,copy from to,copy from to,e51c524d611c4a2289b0ae8222be2367,VoiceMouse_#3_1,copy from front to offic,A Retrieved ReformationA guard cae to the prison shoe-shop where Jimmy Valenine was assiduously stitching uppers and escorted him to the front office There the warden handed Jimmy his paron which had been signed that morning by the governor Jimmy took it in a tired kind of way He had srved nearly ten months of a four year sentence He had expected to stay only about three mnths at the longest When a man with as mny friends on the outside as Jimmy Valenine had is received in the "stir" it is hadly worth while to cut his hair "Now Valentine" said the wrden "youll go out in the moning Brace up and make a man of yourselfa Youre not a bad fellow at heart Stop cracking safes and live straight" "Me" said Jimmy in surprise "Why I never cracked a sae in my life""Oh no" laughed the warden "Of course not Lets see nw How was it you happeed to get sent up on that Springfield job Was it because you wouldnt prove an alibi for fear of compomising somebody in extremely high-toned society Or was it simply a case of a men old jury that had it in for you Its alwys one or the other with you inncent victims""Me" said Jimmy still blakly virtuous "Why warden I neer was in Springfield in my life" "Take him back Cronin" said the warden "and fix him up with outgoing clothes Unlock him at sheven in the morning and let him cme to the bull-pen Better think over my advice Valentine"At a quarter past seven on the next morning Jimmy stood in the wardens outer office He had on a suit of the villainously fittng ready-made clothes and a pair of the stiff squeaky shoes tat the state furnishes to its discharged comulsory guestsThe clerk handed him a railroad ticket and the five bill with which the law expcted him to rehabilitate himself into good citizeship and prosperity The warden gve him a cigar and shook hands Valentine 9762 was chronicled on the books "Pardoned by Governor" and Mr James Valentne walked out into the sunshineDisregarding the song of the birds the waving green trees and the smell of the flowers Jimmy headed straight for a restaurant ,A Retrieved ReformationA guard cae to the prison shoe-shop where Jimmy Valenine was assiduously stitching uppers and escorted him to the front office There the warden handed Jimmy his paron which had been signed that morning by the governor Jimmy took it in a tired kind of way He had srved nearly ten months of a four year sentence He had expected to stay only about three mnths at the longest When a man with as mny friends on the outside as Jimmy Valenine had is received in the "stir" it is hadly worth while to cut his hair "Now Valentine" said the wrden "youll go out in the moning Brace up and make a man of yourselfa Youre not a bad fellow at heart Stop cracking safes and live straight" "Me" said Jimmy in surprise "Why I never cracked a sae in my life""Oh no" laughed the warden "Of course not Lets see nw How was it you happeed to get sent up on that Springfield job Was it because you wouldnt prove an alibi for fear of compomising somebody in extremely high-toned society Or was it simply a case of a men old jury that had it in for you Its alwys one or the other with you inncent victims""Me" said Jimmy still blakly virtuous "Why warden I neer was in Springfield in my life" "Take him back Cronin" said the warden "and fix him up with outgoing clothes Unlock him at sheven in the morning and let him cme to the bull-pen Better think over my advice Valentine"At a quarter past seven on the next morning Jimmy stood in the wardens outer office He had on a suit of the villainously fittng ready-made clothes and a pair of the stiff squeaky shoes tat the state furnishes to its discharged comulsory guestsThe clerk handed him a railroad ticket and the five bill with which the law expcted him to rehabilitate himself into good citizeship and prosperity The warden gve him a cigar and shook hands Valentine 9762 was chronicled on the books "Pardoned by Governor" and Mr James Valentne walked out into the sunshineDisregarding the song of the birds the waving green trees and the smell of the flowers Jimmy headed straight for a restaurant ,2021-05-23 18:52:31
8a66c89a7f6244888c3f674e56fb5e3c,3_VoiceMouse_123456789_23-05-2021,VoiceMouse,123456789,paste,paste,8a66c89a7f6244888c3f674e56fb5e3c,VoiceMouse_#3_3,paste before outside,A Retrieved ReformationA guard cae to the prison shoe-shop where Jimmy Valenine was assiduously stitching uppers and escorted him to the front office There the warden handed Jimmy his paron which had been signed that morning by the governor Jimmy took it in a tired kind of way He had srved nearly ten months of a four year sentence He had expected to stay only about three mnths at the longest When a man with as mny friends on the outside as Jimmy Valenine had is received in the "stir" it is hadly worth while to cut his hair "Now Valentine" said the wrden "youll go out in the moning Brace up and make a man of yourselfa Youre not a bad fellow at heart Stop cracking safes and live straight" "Me" said Jimmy in surprise "Why I never cracked a sae in my life""Oh no" laughed the warden "Of course not Lets see nw How was it you happeed to get sent up on that Springfield job Was it because you wouldnt prove an alibi for fear of compomising somebody in extremely high-toned society Or was it simply a case of a men old jury that had it in for you Its alwys one or the other with you inncent victims""Me" said Jimmy still blakly virtuous "Why warden I neer was in Springfield in my life" "Take him back Cronin" said the warden "and fix him up with outgoing clothes Unlock him at sheven in the morning and let him cme to the bull-pen Better think over my advice Valentine"At a quarter past seven on the next morning Jimmy stood in the wardens outer office He had on a suit of the villainously fittng ready-made clothes and a pair of the stiff squeaky shoes tat the state furnishes to its discharged comulsory guestsThe clerk handed him a railroad ticket and the five bill with which the law expcted him to rehabilitate himself into good citizeship and prosperity The warden gve him a cigar and shook hands Valentine 9762 was chronicled on the books "Pardoned by Governor" and Mr James Valentne walked out into the sunshineDisregarding the song of the birds the waving green trees and the smell of the flowers Jimmy headed straight for a restaurant ,A Retrieved ReformationA guard cae to the prison shoe-shop where Jimmy Valenine was assiduously stitching uppers and escorted him to the front office There the warden handed Jimmy his paron which had been signed that morning by the governor Jimmy took it in a tired kind of way He had srved nearly ten months of a four year sentence He had expected to stay only about three mnths at the longest When a man with as mny friends on the front office outside as Jimmy Valenine had is received in the "stir" it is hadly worth while to cut his hair "Now Valentine" said the wrden "youll go out in the moning Brace up and make a man of yourselfa Youre not a bad fellow at heart Stop cracking safes and live straight" "Me" said Jimmy in surprise "Why I never cracked a sae in my life""Oh no" laughed the warden "Of course not Lets see nw How was it you happeed to get sent up on that Springfield job Was it because you wouldnt prove an alibi for fear of compomising somebody in extremely high-toned society Or was it simply a case of a men old jury that had it in for you Its alwys one or the other with you inncent victims""Me" said Jimmy still blakly virtuous "Why warden I neer was in Springfield in my life" "Take him back Cronin" said the warden "and fix him up with outgoing clothes Unlock him at sheven in the morning and let him cme to the bull-pen Better think over my advice Valentine"At a quarter past seven on the next morning Jimmy stood in the wardens outer office He had on a suit of the villainously fittng ready-made clothes and a pair of the stiff squeaky shoes tat the state furnishes to its discharged comulsory guestsThe clerk handed him a railroad ticket and the five bill with which the law expcted him to rehabilitate himself into good citizeship and prosperity The warden gve him a cigar and shook hands Valentine 9762 was chronicled on the books "Pardoned by Governor" and Mr James Valentne walked out into the sunshineDisregarding the song of the birds the waving green trees and the smell of the flowers Jimmy headed straight for a restaurant ,2021-05-23 18:52:42
91a70e95528742899262bdcbe9e4b6f5,3_VoiceMouse_123456789_23-05-2021,VoiceMouse,123456789,fix,fix,91a70e95528742899262bdcbe9e4b6f5,VoiceMouse_#3_5,fix,A Retrieved ReformationA guard cae to the prison shoe-shop where Jimmy Valenine was assiduously stitching uppers and escorted him to the front office There the warden handed Jimmy his paron which had been signed that morning by the governor Jimmy took it in a tired kind of way He had srved nearly ten months of a four year sentence He had expected to stay only about three mnths at the longest When a man with as mny friends on the front office outside as Jimmy Valenine had is received in the "stir" it is hadly worth while to cut his hair "Now Valentine" said the wrden "youll go out in the moning Brace up and make a man of yourselfa Youre not a bad fellow at heart Stop cracking safes and live straight" "Me" said Jimmy in surprise "Why I never cracked a sae in my life""Oh no" laughed the warden "Of course not Lets see nw How was it you happeed to get sent up on that Springfield job Was it because you wouldnt prove an alibi for fear of compomising somebody in extremely high-toned society Or was it simply a case of a men old jury that had it in for you Its alwys one or the other with you inncent victims""Me" said Jimmy still blakly virtuous "Why warden I neer was in Springfield in my life" "Take him back Cronin" said the warden "and fix him up with outgoing clothes Unlock him at sheven in the morning and let him cme to the bull-pen Better think over my advice Valentine"At a quarter past seven on the next morning Jimmy stood in the wardens outer office He had on a suit of the villainously fittng ready-made clothes and a pair of the stiff squeaky shoes tat the state furnishes to its discharged comulsory guestsThe clerk handed him a railroad ticket and the five bill with which the law expcted him to rehabilitate himself into good citizeship and prosperity The warden gve him a cigar and shook hands Valentine 9762 was chronicled on the books "Pardoned by Governor" and Mr James Valentne walked out into the sunshineDisregarding the song of the birds the waving green trees and the smell of the flowers Jimmy headed straight for a restaurant ,A Retrieved ReformationA guard cae to the prison shoe-shop where Jimmy Valenine was assiduously stitching uppers and escorted him to the front office There the warden handed Jimmy his paron which had been signed that morning by the governor Jimmy took it in a tired kind of way He had srved nearly ten months of a four year sentence He had expected to stay only about three mnths at the longest When a man with as mny friends on the front office outside as Jimmy Valenine had is received in the "stir" it is hadly worth while to cut his hair "Now Valentine" said the wrden "youll go out in the moning Brace up and make a man of yourself Youre not a bad fellow at heart Stop cracking safes and live straight" "Me" said Jimmy in surprise "Why I never cracked a sae in my life""Oh no" laughed the warden "Of course not Lets see nw How was it you happeed to get sent up on that Springfield job Was it because you wouldnt prove an alibi for fear of compomising somebody in extremely high-toned society Or was it simply a case of a men old jury that had it in for you Its alwys one or the other with you inncent victims""Me" said Jimmy still blakly virtuous "Why warden I neer was in Springfield in my life" "Take him back Cronin" said the warden "and fix him up with outgoing clothes Unlock him at sheven in the morning and let him cme to the bull-pen Better think over my advice Valentine"At a quarter past seven on the next morning Jimmy stood in the wardens outer office He had on a suit of the villainously fittng ready-made clothes and a pair of the stiff squeaky shoes tat the state furnishes to its discharged comulsory guestsThe clerk handed him a railroad ticket and the five bill with which the law expcted him to rehabilitate himself into good citizeship and prosperity The warden gve him a cigar and shook hands Valentine 9762 was chronicled on the books "Pardoned by Governor" and Mr James Valentne walked out into the sunshineDisregarding the song of the birds the waving green trees and the smell of the flowers Jimmy headed straight for a restaurant ,2021-05-23 18:52:51
