CID,ExperimentID,SystemName,UserID,Command,BaseCommand,BaseCID,MissionID,args,before,after,Timestamp
e4b8f2351e4c4b51ab5f958ebcb270fd,1_VoiceMouse_123456789_23-05-2021,VoiceMouse,123456789,replace,replace,e4b8f2351e4c4b51ab5f958ebcb270fd,VoiceMouse_#1_3,replace back to front,One Summer NightThe fact that Henry Armstrong was buried did not sem to him to prove tat he was dead he had always been a hard man to convince That he relly was buried the testimony of his senses compelled him to admit  His posture flat upon his back with his hands crossed upon his stomach and tied with something that he easly broke without profitably alteing the situation the strict confinement of his entire person the black darkness and profound silnce made a body of evidence impossible to controvert and he accepted it without cavil But dead no he was only very very ill He had wital the invalids apathy and did not greatly concern himself about the uncomon fate that had een allotted to him No philosopher was he just a plain commonplace person gifted for the being with a pathological indifference the organ that he feared consequences with was torpid So with no particular apprehension for his immdiate future he fell aslep and all was peace with Hnry Armstrong  But soething was going on overhad It was a dark sumer night shot through with infrequent shimmers of lightning silently firing a cloud lying low in the est and portending a storm These brief stammering illuminations brought out with ghasly Distinctness the monments and headstones of the cemetey and seemed to set them dancing It was not a night in which any credible witnss was likely to be straying about a cemetery so the three men who wee there digging into the grave of Hery Armstrong felt reasonably secure Two of them were yong students from a medical college a few miles aay the third was a gigantic negro known as Jess For many years Jess had been employed about the cemtery as a man-of-all-work and his favorite pleasntry that he knew every sol in the place  From the natre of what he was now doing it was inferble that the place was not so popuous as its register may have shown it to be Outside the wall at the part of the grounds farthest from the public road were a hore and a light wagon waitng ,One Summer NightThe fact that Henry Armstrong was buried did not sem to him to prove tat he was dead he had always been a hard man to convince That he relly was buried the testimony of his senses compelled him to admit  His posture flat upon his front with his hands crossed upon his stomach and tied with something that he easly broke without profitably alteing the situation the strict confinement of his entire person the black darkness and profound silnce made a body of evidence impossible to controvert and he accepted it without cavil But dead no he was only very very ill He had wital the invalids apathy and did not greatly concern himself about the uncomon fate that had een allotted to him No philosopher was he just a plain commonplace person gifted for the being with a pathological indifference the organ that he feared consequences with was torpid So with no particular apprehension for his immdiate future he fell aslep and all was peace with Hnry Armstrong  But soething was going on overhad It was a dark sumer night shot through with infrequent shimmers of lightning silently firing a cloud lying low in the est and portending a storm These brief stammering illuminations brought out with ghasly Distinctness the monments and headstones of the cemetey and seemed to set them dancing It was not a night in which any credible witnss was likely to be straying about a cemetery so the three men who wee there digging into the grave of Hery Armstrong felt reasonably secure Two of them were yong students from a medical college a few miles aay the third was a gigantic negro known as Jess For many years Jess had been employed about the cemtery as a man-of-all-work and his favorite pleasntry that he knew every sol in the place  From the natre of what he was now doing it was inferble that the place was not so popuous as its register may have shown it to be Outside the wall at the part of the grounds farthest from the public road were a hore and a light wagon waitng ,2021-05-23 18:47:54
f2dd229b76d74881961655498c951d14,1_VoiceMouse_123456789_23-05-2021,VoiceMouse,123456789,add,add,f2dd229b76d74881961655498c951d14,VoiceMouse_#1_5,add time after the,One Summer NightThe fact that Henry Armstrong was buried did not sem to him to prove tat he was dead he had always been a hard man to convince That he relly was buried the testimony of his senses compelled him to admit  His posture flat upon his front with his hands crossed upon his stomach and tied with something that he easly broke without profitably alteing the situation the strict confinement of his entire person the black darkness and profound silnce made a body of evidence impossible to controvert and he accepted it without cavil But dead no he was only very very ill He had wital the invalids apathy and did not greatly concern himself about the uncomon fate that had een allotted to him No philosopher was he just a plain commonplace person gifted for the being with a pathological indifference the organ that he feared consequences with was torpid So with no particular apprehension for his immdiate future he fell aslep and all was peace with Hnry Armstrong  But soething was going on overhad It was a dark sumer night shot through with infrequent shimmers of lightning silently firing a cloud lying low in the est and portending a storm These brief stammering illuminations brought out with ghasly Distinctness the monments and headstones of the cemetey and seemed to set them dancing It was not a night in which any credible witnss was likely to be straying about a cemetery so the three men who wee there digging into the grave of Hery Armstrong felt reasonably secure Two of them were yong students from a medical college a few miles aay the third was a gigantic negro known as Jess For many years Jess had been employed about the cemtery as a man-of-all-work and his favorite pleasntry that he knew every sol in the place  From the natre of what he was now doing it was inferble that the place was not so popuous as its register may have shown it to be Outside the wall at the part of the grounds farthest from the public road were a hore and a light wagon waitng ,One Summer NightThe fact that Henry Armstrong was buried did not sem to him to prove tat he was dead he had always been a hard man to convince That he relly was buried the testimony of his senses compelled him to admit  His posture flat upon his front with his hands crossed upon his stomach and tied with something that he easly broke without profitably alteing the situation the strict confinement of his entire person the black darkness and profound silnce made a body of evidence impossible to controvert and he accepted it without cavil But dead no he was only very very ill He had wital the invalids apathy and did not greatly concern himself about the uncomon fate that had een allotted to him No philosopher was he just a plain commonplace person gifted for the time being with a pathological indifference the organ that he feared consequences with was torpid So with no particular apprehension for his immdiate future he fell aslep and all was peace with Hnry Armstrong  But soething was going on overhad It was a dark sumer night shot through with infrequent shimmers of lightning silently firing a cloud lying low in the est and portending a storm These brief stammering illuminations brought out with ghasly Distinctness the monments and headstones of the cemetey and seemed to set them dancing It was not a night in which any credible witnss was likely to be straying about a cemetery so the three men who wee there digging into the grave of Hery Armstrong felt reasonably secure Two of them were yong students from a medical college a few miles aay the third was a gigantic negro known as Jess For many years Jess had been employed about the cemtery as a man-of-all-work and his favorite pleasntry that he knew every sol in the place  From the natre of what he was now doing it was inferble that the place was not so popuous as its register may have shown it to be Outside the wall at the part of the grounds farthest from the public road were a hore and a light wagon waitng ,2021-05-23 18:48:07
35a1707bb99d404288bfa30c61c339e1,1_VoiceMouse_123456789_23-05-2021,VoiceMouse,123456789,fix,fix,35a1707bb99d404288bfa30c61c339e1,VoiceMouse_#1_7,fix,One Summer NightThe fact that Henry Armstrong was buried did not sem to him to prove tat he was dead he had always been a hard man to convince That he relly was buried the testimony of his senses compelled him to admit  His posture flat upon his front with his hands crossed upon his stomach and tied with something that he easly broke without profitably alteing the situation the strict confinement of his entire person the black darkness and profound silnce made a body of evidence impossible to controvert and he accepted it without cavil But dead no he was only very very ill He had wital the invalids apathy and did not greatly concern himself about the uncomon fate that had een allotted to him No philosopher was he just a plain commonplace person gifted for the time being with a pathological indifference the organ that he feared consequences with was torpid So with no particular apprehension for his immdiate future he fell aslep and all was peace with Hnry Armstrong  But soething was going on overhad It was a dark sumer night shot through with infrequent shimmers of lightning silently firing a cloud lying low in the est and portending a storm These brief stammering illuminations brought out with ghasly Distinctness the monments and headstones of the cemetey and seemed to set them dancing It was not a night in which any credible witnss was likely to be straying about a cemetery so the three men who wee there digging into the grave of Hery Armstrong felt reasonably secure Two of them were yong students from a medical college a few miles aay the third was a gigantic negro known as Jess For many years Jess had been employed about the cemtery as a man-of-all-work and his favorite pleasntry that he knew every sol in the place  From the natre of what he was now doing it was inferble that the place was not so popuous as its register may have shown it to be Outside the wall at the part of the grounds farthest from the public road were a hore and a light wagon waitng ,One Summer NightThe fact that Henry Armstrong was buried did not sem to him to prove tat he was dead he had always been a hard man to convince That he relly was buried the testimony of his senses compelled him to admit  His posture flat upon his front with his hands crossed upon his stomach and tied with something that he easly broke without profitably alteing the situation the strict confinement of his entire person the black darkness and profound silnce made a body of evidence impossible to controvert and he accepted it without cavil But dead no he was only very very ill He had wital the invalids apathy and did not greatly concern himself about the uncomon fate that had een allotted to him No philosopher was he just a plain commonplace person gifted for the time being with a pathological indifference the organ that he feared consequences with was torpid So with no particular apprehension for his immdiate future he fell aslep and all was peace with Hnry Armstrong  But soething was going on overhad It was a dark sumer night shot through with infrequent shimmers of lightning silently firing a cloud lying low in the Est and portending a storm These brief stammering illuminations brought out with ghasly Distinctness the monments and headstones of the cemetey and seemed to set them dancing It was not a night in which any credible witnss was likely to be straying about a cemetery so the three men who wee there digging into the grave of Hery Armstrong felt reasonably secure Two of them were yong students from a medical college a few miles aay the third was a gigantic negro known as Jess For many years Jess had been employed about the cemtery as a man-of-all-work and his favorite pleasntry that he knew every sol in the place  From the natre of what he was now doing it was inferble that the place was not so popuous as its register may have shown it to be Outside the wall at the part of the grounds farthest from the public road were a hore and a light wagon waitng ,2021-05-23 18:48:16
ac3a21f1cf914c2297af55165d26b9ba,1_VoiceMouse_123456789_23-05-2021,VoiceMouse,123456789,options,fix,35a1707bb99d404288bfa30c61c339e1,VoiceMouse_#1_7,options 2,One Summer NightThe fact that Henry Armstrong was buried did not sem to him to prove tat he was dead he had always been a hard man to convince That he relly was buried the testimony of his senses compelled him to admit  His posture flat upon his front with his hands crossed upon his stomach and tied with something that he easly broke without profitably alteing the situation the strict confinement of his entire person the black darkness and profound silnce made a body of evidence impossible to controvert and he accepted it without cavil But dead no he was only very very ill He had wital the invalids apathy and did not greatly concern himself about the uncomon fate that had een allotted to him No philosopher was he just a plain commonplace person gifted for the time being with a pathological indifference the organ that he feared consequences with was torpid So with no particular apprehension for his immdiate future he fell aslep and all was peace with Hnry Armstrong  But soething was going on overhad It was a dark sumer night shot through with infrequent shimmers of lightning silently firing a cloud lying low in the Est and portending a storm These brief stammering illuminations brought out with ghasly Distinctness the monments and headstones of the cemetey and seemed to set them dancing It was not a night in which any credible witnss was likely to be straying about a cemetery so the three men who wee there digging into the grave of Hery Armstrong felt reasonably secure Two of them were yong students from a medical college a few miles aay the third was a gigantic negro known as Jess For many years Jess had been employed about the cemtery as a man-of-all-work and his favorite pleasntry that he knew every sol in the place  From the natre of what he was now doing it was inferble that the place was not so popuous as its register may have shown it to be Outside the wall at the part of the grounds farthest from the public road were a hore and a light wagon waitng ,One Summer NightThe fact that Henry Armstrong was buried did not sem to him to prove tat he was dead he had always been a hard man to convince That he relly was buried the testimony of his senses compelled him to admit  His posture flat upon his front with his hands crossed upon his stomach and tied with something that he easly broke without profitably alteing the situation the strict confinement of his entire person the black darkness and profound silnce made a body of evidence impossible to controvert and he accepted it without cavil But dead no he was only very very ill He had wital the invalids apathy and did not greatly concern himself about the uncomon fate that had een allotted to him No philosopher was he just a plain commonplace person gifted for the time being with a pathological indifference the organ that he feared consequences with was torpid So with no particular apprehension for his immdiate future he fell aslep and all was peace with Hnry Armstrong  But soething was going on overhad It was a dark sumer night shot through with infrequent shimmers of lightning silently firing a cloud lying low in the east and portending a storm These brief stammering illuminations brought out with ghasly Distinctness the monments and headstones of the cemetey and seemed to set them dancing It was not a night in which any credible witnss was likely to be straying about a cemetery so the three men who wee there digging into the grave of Hery Armstrong felt reasonably secure Two of them were yong students from a medical college a few miles aay the third was a gigantic negro known as Jess For many years Jess had been employed about the cemtery as a man-of-all-work and his favorite pleasntry that he knew every sol in the place  From the natre of what he was now doing it was inferble that the place was not so popuous as its register may have shown it to be Outside the wall at the part of the grounds farthest from the public road were a hore and a light wagon waitng ,2021-05-23 18:48:26
12d2c35fd0e94f009c7c201134c9d251,1_VoiceMouse_123456789_23-05-2021,VoiceMouse,123456789,copy from to,copy from to,12d2c35fd0e94f009c7c201134c9d251,VoiceMouse_#1_9,copy from It to not,One Summer NightThe fact that Henry Armstrong was buried did not sem to him to prove tat he was dead he had always been a hard man to convince That he relly was buried the testimony of his senses compelled him to admit  His posture flat upon his front with his hands crossed upon his stomach and tied with something that he easly broke without profitably alteing the situation the strict confinement of his entire person the black darkness and profound silnce made a body of evidence impossible to controvert and he accepted it without cavil But dead no he was only very very ill He had wital the invalids apathy and did not greatly concern himself about the uncomon fate that had een allotted to him No philosopher was he just a plain commonplace person gifted for the time being with a pathological indifference the organ that he feared consequences with was torpid So with no particular apprehension for his immdiate future he fell aslep and all was peace with Hnry Armstrong  But soething was going on overhad It was a dark sumer night shot through with infrequent shimmers of lightning silently firing a cloud lying low in the east and portending a storm These brief stammering illuminations brought out with ghasly Distinctness the monments and headstones of the cemetey and seemed to set them dancing It was not a night in which any credible witnss was likely to be straying about a cemetery so the three men who wee there digging into the grave of Hery Armstrong felt reasonably secure Two of them were yong students from a medical college a few miles aay the third was a gigantic negro known as Jess For many years Jess had been employed about the cemtery as a man-of-all-work and his favorite pleasntry that he knew every sol in the place  From the natre of what he was now doing it was inferble that the place was not so popuous as its register may have shown it to be Outside the wall at the part of the grounds farthest from the public road were a hore and a light wagon waitng ,One Summer NightThe fact that Henry Armstrong was buried did not sem to him to prove tat he was dead he had always been a hard man to convince That he relly was buried the testimony of his senses compelled him to admit  His posture flat upon his front with his hands crossed upon his stomach and tied with something that he easly broke without profitably alteing the situation the strict confinement of his entire person the black darkness and profound silnce made a body of evidence impossible to controvert and he accepted it without cavil But dead no he was only very very ill He had wital the invalids apathy and did not greatly concern himself about the uncomon fate that had een allotted to him No philosopher was he just a plain commonplace person gifted for the time being with a pathological indifference the organ that he feared consequences with was torpid So with no particular apprehension for his immdiate future he fell aslep and all was peace with Hnry Armstrong  But soething was going on overhad It was a dark sumer night shot through with infrequent shimmers of lightning silently firing a cloud lying low in the east and portending a storm These brief stammering illuminations brought out with ghasly Distinctness the monments and headstones of the cemetey and seemed to set them dancing It was not a night in which any credible witnss was likely to be straying about a cemetery so the three men who wee there digging into the grave of Hery Armstrong felt reasonably secure Two of them were yong students from a medical college a few miles aay the third was a gigantic negro known as Jess For many years Jess had been employed about the cemtery as a man-of-all-work and his favorite pleasntry that he knew every sol in the place  From the natre of what he was now doing it was inferble that the place was not so popuous as its register may have shown it to be Outside the wall at the part of the grounds farthest from the public road were a hore and a light wagon waitng ,2021-05-23 18:49:29
5c4f39b2ce8a44ebaa48fcb81e8cd9d9,1_VoiceMouse_123456789_23-05-2021,VoiceMouse,123456789,paste,paste,5c4f39b2ce8a44ebaa48fcb81e8cd9d9,VoiceMouse_#1_11,paste after end,One Summer NightThe fact that Henry Armstrong was buried did not sem to him to prove tat he was dead he had always been a hard man to convince That he relly was buried the testimony of his senses compelled him to admit  His posture flat upon his front with his hands crossed upon his stomach and tied with something that he easly broke without profitably alteing the situation the strict confinement of his entire person the black darkness and profound silnce made a body of evidence impossible to controvert and he accepted it without cavil But dead no he was only very very ill He had wital the invalids apathy and did not greatly concern himself about the uncomon fate that had een allotted to him No philosopher was he just a plain commonplace person gifted for the time being with a pathological indifference the organ that he feared consequences with was torpid So with no particular apprehension for his immdiate future he fell aslep and all was peace with Hnry Armstrong  But soething was going on overhad It was a dark sumer night shot through with infrequent shimmers of lightning silently firing a cloud lying low in the east and portending a storm These brief stammering illuminations brought out with ghasly Distinctness the monments and headstones of the cemetey and seemed to set them dancing It was not a night in which any credible witnss was likely to be straying about a cemetery so the three men who wee there digging into the grave of Hery Armstrong felt reasonably secure Two of them were yong students from a medical college a few miles aay the third was a gigantic negro known as Jess For many years Jess had been employed about the cemtery as a man-of-all-work and his favorite pleasntry that he knew every sol in the place  From the natre of what he was now doing it was inferble that the place was not so popuous as its register may have shown it to be Outside the wall at the part of the grounds farthest from the public road were a hore and a light wagon waitng ,One Summer NightThe fact that Henry Armstrong was buried did not sem to him to prove tat he was dead he had always been a hard man to convince That he relly was buried the testimony of his senses compelled him to admit  His posture flat upon his front with his hands crossed upon his stomach and tied with something that he easly broke without profitably alteing the situation the strict confinement of his entire person the black darkness and profound silnce made a body of evidence impossible to controvert and he accepted it without cavil But dead no he was only very very ill He had wital the invalids apathy and did not greatly concern himself about the uncomon fate that had een allotted to him No philosopher was he just a plain commonplace person gifted for the time being with a pathological indifference the organ that he feared consequences with was torpid So with no particular apprehension for his immdiate future he fell aslep and all was peace with Hnry Armstrong  But soething was going on overhad It was a dark sumer night shot through with infrequent shimmers of lightning silently firing a cloud lying low in the east and portending a storm These brief stammering illuminations brought out with ghasly Distinctness the monments and headstones of the cemetey and seemed to set them dancing It was not a night in which any credible witnss was likely to be straying about a cemetery so the three men who wee there digging into the grave of Hery Armstrong felt reasonably secure Two of them were yong students from a medical college a few miles aay the third was a gigantic negro known as Jess For many years Jess had been employed about the cemtery as a man-of-all-work and It was not his favorite pleasntry that he knew every sol in the place  From the natre of what he was now doing it was inferble that the place was not so popuous as its register may have shown it to be Outside the wall at the part of the grounds farthest from the public road were a hore and a light wagon waitng ,2021-05-23 18:49:42
